{
    "$schema": "http://json-schema.org/draft-07/schema#",
    "$id": "https://raw.githubusercontent.com/dedis/popstellar/master/protocol/query/method/message/data/dataFederationInit.json",
    "description": "Sent by an organizer client to its server, initiates a connection to a remote LAO",
    "type": "object",
    "properties": {
        "object": {
            "const": "federation"
        },
        "action": {
            "const": "init"
        },
        "lao_id": {
            "type": "string",
            "contentEncoding": "base64",
            "$comment": "ID of the remote LAO"
        },
        "server_address": {
            "type": "string",
            "pattern": "^(ws|wss):\/\/.*(:\\d{0,5})?\/.*$",
            "$comment": "public address of the remote organizer server"
        },
        "public_key": {
            "type": "string",
            "contentEncoding": "base64",
            "$comment": "public key of the remote organizer"
        },
        "challenge": {
            "$ref": "../message.json",
            "$comment": "message/message containing a FederationChallenge data"
        }
    },
    "additionalProperties": false,
    "required": [
        "object",
        "action",
        "lao_id",
        "server_address",
        "public_key",
        "challenge"
    ]
}