{
    "object": "federation",
    "action": "init",
    "lao_id": "fzJSZjKf-2cbXH7kds9H8NORuuFIRLkevJlN7qQemjo=",
    "public_key": "J9fBzJV70Jk5c-i3277Uq4CmeL4t53WDfUghaK0HpeM=",
    "server_address": "wss://epfl.ch:9000/server",
    "challenge": "ewogICAgICAgICJEYXRhIjogImV5SnZZbXBsWTNRaU9pSm1aV1JsY21GMGFXOXVJaXdpWVdOMGFXOXVJam9pWTJoaGJHeGxibWRsSWl3aWRtRnNkV1VpT2lKbFltRXpaVEkwWldaalpEQmlOVE5tWVRZNU9UQTRZbUZrTldReFkySTJPVGxrTnprNE1HUTVNekV3T1dSaE1HSXlZbVprTlRBek4yTXlZemc1WldVd0lpd2lkR2x0WlhOMFlXMXdJam94TnpFek16ZzFOVFk0ZlE9PSIsCiAgICAgICAgIlNlbmRlciI6ICJ6WGd6UWFhX05wVWUtdjBaa180cThrMTg0b2hRNW5UUWhCREtnbmNIenE0PSIsCiAgICAgICAgIlNpZ25hdHVyZSI6ICJCSUxZd1lrVDV0T0JMNHJDRDd5dmhCa2hBWXFSWE9JM2FqUTJ1SjFnQWstZzZuUmMzOHZNTW5sSFNodU5DUTNkUUZYWVpQbjM3Y0NGZWxoV0dqWThCZz09IiwKICAgICAgICAiTWVzc2FnZUlEIjogInNEX1BkcnlCdU9yMTRfNjVoOEwtZTFsemRRcERXeFVBbmd0dTF1d3FnRUk9IiwKICAgICAgICAiV2l0bmVzc1NpZ25hdHVyZXMiOiBbXQogICAgfQ=="
}